[INFO] Scanning for projects...
[INFO] 
[INFO] --------------------------< com.example:demo >--------------------------
[INFO] Building demo 0.0.1-SNAPSHOT
[INFO]   from pom.xml
[INFO] --------------------------------[ jar ]---------------------------------
[INFO] 
[INFO] --- clean:3.4.0:clean (default-clean) @ demo ---
[INFO] Deleting /home/luciano/Programming/personal/spring-rest-docs-demo/target
[INFO] 
[INFO] --- jacoco:0.8.12:prepare-agent (jacoco-initialize) @ demo ---
[INFO] argLine set to -javaagent:/home/luciano/.m2/repository/org/jacoco/org.jacoco.agent/0.8.12/org.jacoco.agent-0.8.12-runtime.jar=destfile=/home/luciano/Programming/personal/spring-rest-docs-demo/target/jacoco.exec
[INFO] 
[INFO] --- resources:3.3.1:resources (default-resources) @ demo ---
[INFO] Copying 1 resource from src/main/resources to target/classes
[INFO] Copying 0 resource from src/main/resources to target/classes
[INFO] 
[INFO] --- compiler:3.13.0:compile (default-compile) @ demo ---
[INFO] Recompiling the module because of changed source code.
[INFO] Compiling 16 source files with javac [debug parameters release 21] to target/classes
[INFO] 
[INFO] --- resources:3.3.1:testResources (default-testResources) @ demo ---
[INFO] skip non existing resourceDirectory /home/luciano/Programming/personal/spring-rest-docs-demo/src/test/resources
[INFO] 
[INFO] --- compiler:3.13.0:testCompile (default-testCompile) @ demo ---
[INFO] Recompiling the module because of changed dependency.
[INFO] Compiling 4 source files with javac [debug parameters release 21] to target/test-classes
[INFO] 
[INFO] --- surefire:3.5.2:test (default-test) @ demo ---
[INFO] Using auto detected provider org.apache.maven.surefire.junitplatform.JUnitPlatformProvider
[INFO] 
[INFO] -------------------------------------------------------
[INFO]  T E S T S
[INFO] -------------------------------------------------------
[INFO] Running com.example.demo.controllers.AuthorControllerTests
15:14:55.093 [main] INFO org.springframework.test.context.support.AnnotationConfigContextLoaderUtils -- Could not detect default configuration classes for test class [com.example.demo.controllers.AuthorControllerTests]: AuthorControllerTests does not declare any static, non-private, non-final, nested classes annotated with @Configuration.
15:14:55.227 [main] INFO org.springframework.boot.test.context.SpringBootTestContextBootstrapper -- Found @SpringBootConfiguration com.example.demo.DemoApplication for test class com.example.demo.controllers.AuthorControllerTests
15:14:55.305 [main] INFO org.springframework.boot.devtools.restart.RestartApplicationListener -- Restart disabled due to context in which it is running

  .   ____          _            __ _ _
 /\\ / ___'_ __ _ _(_)_ __  __ _ \ \ \ \
( ( )\___ | '_ | '_| | '_ \/ _` | \ \ \ \
 \\/  ___)| |_)| | | | | || (_| |  ) ) ) )
  '  |____| .__|_| |_|_| |_\__, | / / / /
 =========|_|==============|___/=/_/_/_/

 :: Spring Boot ::                (v3.4.1)

2025-01-14T15:14:55.606-05:00  INFO 99939 --- [demo] [           main] c.e.d.controllers.AuthorControllerTests  : Starting AuthorControllerTests using Java 21.0.5 with PID 99939 (started by luciano in /home/luciano/Programming/personal/spring-rest-docs-demo)
2025-01-14T15:14:55.607-05:00  INFO 99939 --- [demo] [           main] c.e.d.controllers.AuthorControllerTests  : No active profile set, falling back to 1 default profile: "default"
2025-01-14T15:14:57.461-05:00  INFO 99939 --- [demo] [           main] o.s.b.t.m.w.SpringBootMockServletContext : Initializing Spring TestDispatcherServlet ''
2025-01-14T15:14:57.462-05:00  INFO 99939 --- [demo] [           main] o.s.t.web.servlet.TestDispatcherServlet  : Initializing Servlet ''
2025-01-14T15:14:57.465-05:00  INFO 99939 --- [demo] [           main] o.s.t.web.servlet.TestDispatcherServlet  : Completed initialization in 1 ms
2025-01-14T15:14:57.487-05:00  INFO 99939 --- [demo] [           main] c.e.d.controllers.AuthorControllerTests  : Started AuthorControllerTests in 2.193 seconds (process running for 3.101)
[INFO] Tests run: 4, Failures: 0, Errors: 0, Skipped: 0, Time elapsed: 3.093 s -- in com.example.demo.controllers.AuthorControllerTests
[INFO] Running com.example.demo.controllers.BookControllerTests
2025-01-14T15:14:58.009-05:00  INFO 99939 --- [demo] [           main] t.c.s.AnnotationConfigContextLoaderUtils : Could not detect default configuration classes for test class [com.example.demo.controllers.BookControllerTests]: BookControllerTests does not declare any static, non-private, non-final, nested classes annotated with @Configuration.
2025-01-14T15:14:58.013-05:00  INFO 99939 --- [demo] [           main] .b.t.c.SpringBootTestContextBootstrapper : Found @SpringBootConfiguration com.example.demo.DemoApplication for test class com.example.demo.controllers.BookControllerTests
2025-01-14T15:14:58.017-05:00  INFO 99939 --- [demo] [           main] o.s.b.d.r.RestartApplicationListener     : Restart disabled due to context in which it is running

  .   ____          _            __ _ _
 /\\ / ___'_ __ _ _(_)_ __  __ _ \ \ \ \
( ( )\___ | '_ | '_| | '_ \/ _` | \ \ \ \
 \\/  ___)| |_)| | | | | || (_| |  ) ) ) )
  '  |____| .__|_| |_|_| |_\__, | / / / /
 =========|_|==============|___/=/_/_/_/

 :: Spring Boot ::                (v3.4.1)

2025-01-14T15:14:58.038-05:00  INFO 99939 --- [demo] [           main] c.e.d.controllers.BookControllerTests    : Starting BookControllerTests using Java 21.0.5 with PID 99939 (started by luciano in /home/luciano/Programming/personal/spring-rest-docs-demo)
2025-01-14T15:14:58.039-05:00  INFO 99939 --- [demo] [           main] c.e.d.controllers.BookControllerTests    : No active profile set, falling back to 1 default profile: "default"
2025-01-14T15:14:58.227-05:00  INFO 99939 --- [demo] [           main] o.s.b.t.m.w.SpringBootMockServletContext : Initializing Spring TestDispatcherServlet ''
2025-01-14T15:14:58.228-05:00  INFO 99939 --- [demo] [           main] o.s.t.web.servlet.TestDispatcherServlet  : Initializing Servlet ''
2025-01-14T15:14:58.228-05:00  INFO 99939 --- [demo] [           main] o.s.t.web.servlet.TestDispatcherServlet  : Completed initialization in 0 ms
2025-01-14T15:14:58.233-05:00  INFO 99939 --- [demo] [           main] c.e.d.controllers.BookControllerTests    : Started BookControllerTests in 0.217 seconds (process running for 3.848)
[INFO] Tests run: 3, Failures: 0, Errors: 0, Skipped: 0, Time elapsed: 0.288 s -- in com.example.demo.controllers.BookControllerTests
[INFO] Running com.example.demo.DemoApplicationTests
2025-01-14T15:14:58.297-05:00  INFO 99939 --- [demo] [           main] t.c.s.AnnotationConfigContextLoaderUtils : Could not detect default configuration classes for test class [com.example.demo.DemoApplicationTests]: DemoApplicationTests does not declare any static, non-private, non-final, nested classes annotated with @Configuration.
2025-01-14T15:14:58.301-05:00  INFO 99939 --- [demo] [           main] .b.t.c.SpringBootTestContextBootstrapper : Found @SpringBootConfiguration com.example.demo.DemoApplication for test class com.example.demo.DemoApplicationTests
2025-01-14T15:14:58.304-05:00  INFO 99939 --- [demo] [           main] o.s.b.d.r.RestartApplicationListener     : Restart disabled due to context in which it is running

  .   ____          _            __ _ _
 /\\ / ___'_ __ _ _(_)_ __  __ _ \ \ \ \
( ( )\___ | '_ | '_| | '_ \/ _` | \ \ \ \
 \\/  ___)| |_)| | | | | || (_| |  ) ) ) )
  '  |____| .__|_| |_|_| |_\__, | / / / /
 =========|_|==============|___/=/_/_/_/

 :: Spring Boot ::                (v3.4.1)

2025-01-14T15:14:58.314-05:00  INFO 99939 --- [demo] [           main] com.example.demo.DemoApplicationTests    : Starting DemoApplicationTests using Java 21.0.5 with PID 99939 (started by luciano in /home/luciano/Programming/personal/spring-rest-docs-demo)
2025-01-14T15:14:58.314-05:00  INFO 99939 --- [demo] [           main] com.example.demo.DemoApplicationTests    : No active profile set, falling back to 1 default profile: "default"
2025-01-14T15:14:58.483-05:00  INFO 99939 --- [demo] [           main] .s.d.r.c.RepositoryConfigurationDelegate : Bootstrapping Spring Data JPA repositories in DEFAULT mode.
2025-01-14T15:14:58.512-05:00  INFO 99939 --- [demo] [           main] .s.d.r.c.RepositoryConfigurationDelegate : Finished Spring Data repository scanning in 22 ms. Found 2 JPA repository interfaces.
2025-01-14T15:14:58.652-05:00  INFO 99939 --- [demo] [           main] com.zaxxer.hikari.HikariDataSource       : HikariPool-1 - Starting...
2025-01-14T15:14:58.884-05:00  INFO 99939 --- [demo] [           main] com.zaxxer.hikari.pool.HikariPool        : HikariPool-1 - Added connection conn0: url=jdbc:h2:mem:15db245e-e14d-412e-b2ac-8a734cc95866 user=SA
2025-01-14T15:14:58.886-05:00  INFO 99939 --- [demo] [           main] com.zaxxer.hikari.HikariDataSource       : HikariPool-1 - Start completed.
2025-01-14T15:14:58.932-05:00  INFO 99939 --- [demo] [           main] o.hibernate.jpa.internal.util.LogHelper  : HHH000204: Processing PersistenceUnitInfo [name: default]
2025-01-14T15:14:58.980-05:00  INFO 99939 --- [demo] [           main] org.hibernate.Version                    : HHH000412: Hibernate ORM core version 6.6.4.Final
2025-01-14T15:14:59.016-05:00  INFO 99939 --- [demo] [           main] o.h.c.internal.RegionFactoryInitiator    : HHH000026: Second-level cache disabled
2025-01-14T15:14:59.123-05:00  INFO 99939 --- [demo] [           main] o.s.o.j.p.SpringPersistenceUnitInfo      : No LoadTimeWeaver setup: ignoring JPA class transformer
2025-01-14T15:14:59.188-05:00  INFO 99939 --- [demo] [           main] org.hibernate.orm.connections.pooling    : HHH10001005: Database info:
	Database JDBC URL [Connecting through datasource 'HikariDataSource (HikariPool-1)']
	Database driver: undefined/unknown
	Database version: 2.3.232
	Autocommit mode: undefined/unknown
	Isolation level: undefined/unknown
	Minimum pool size: undefined/unknown
	Maximum pool size: undefined/unknown
2025-01-14T15:14:59.729-05:00  INFO 99939 --- [demo] [           main] o.h.e.t.j.p.i.JtaPlatformInitiator       : HHH000489: No JTA platform available (set 'hibernate.transaction.jta.platform' to enable JTA platform integration)
2025-01-14T15:14:59.764-05:00  INFO 99939 --- [demo] [           main] j.LocalContainerEntityManagerFactoryBean : Initialized JPA EntityManagerFactory for persistence unit 'default'
2025-01-14T15:14:59.887-05:00  WARN 99939 --- [demo] [           main] o.s.w.c.s.GenericWebApplicationContext   : Exception encountered during context initialization - cancelling refresh attempt: org.springframework.beans.factory.UnsatisfiedDependencyException: Error creating bean with name 'authorController' defined in file [/home/luciano/Programming/personal/spring-rest-docs-demo/target/classes/com/example/demo/controllers/AuthorController.class]: Unsatisfied dependency expressed through constructor parameter 0: Error creating bean with name 'authorService' defined in file [/home/luciano/Programming/personal/spring-rest-docs-demo/target/classes/com/example/demo/services/AuthorService.class]: Unsatisfied dependency expressed through constructor parameter 1: No qualifying bean of type 'com.example.demo.models.mappers.AuthorMapper' available: expected at least 1 bean which qualifies as autowire candidate. Dependency annotations: {}
2025-01-14T15:14:59.888-05:00  INFO 99939 --- [demo] [           main] j.LocalContainerEntityManagerFactoryBean : Closing JPA EntityManagerFactory for persistence unit 'default'
2025-01-14T15:14:59.890-05:00  INFO 99939 --- [demo] [           main] com.zaxxer.hikari.HikariDataSource       : HikariPool-1 - Shutdown initiated...
2025-01-14T15:14:59.891-05:00  INFO 99939 --- [demo] [           main] com.zaxxer.hikari.HikariDataSource       : HikariPool-1 - Shutdown completed.
2025-01-14T15:14:59.897-05:00  INFO 99939 --- [demo] [           main] .s.b.a.l.ConditionEvaluationReportLogger : 

Error starting ApplicationContext. To display the condition evaluation report re-run your application with 'debug' enabled.
2025-01-14T15:14:59.912-05:00 ERROR 99939 --- [demo] [           main] o.s.b.d.LoggingFailureAnalysisReporter   : 

***************************
APPLICATION FAILED TO START
***************************

Description:

Parameter 1 of constructor in com.example.demo.services.AuthorService required a bean of type 'com.example.demo.models.mappers.AuthorMapper' that could not be found.


Action:

Consider defining a bean of type 'com.example.demo.models.mappers.AuthorMapper' in your configuration.

2025-01-14T15:14:59.914-05:00  WARN 99939 --- [demo] [           main] o.s.test.context.TestContextManager      : Caught exception while allowing TestExecutionListener [org.springframework.test.context.web.ServletTestExecutionListener] to prepare test instance [com.example.demo.DemoApplicationTests@34584446]

java.lang.IllegalStateException: Failed to load ApplicationContext for [WebMergedContextConfiguration@4dab3e26 testClass = com.example.demo.DemoApplicationTests, locations = [], classes = [com.example.demo.DemoApplication], contextInitializerClasses = [], activeProfiles = [], propertySourceDescriptors = [], propertySourceProperties = ["org.springframework.boot.test.context.SpringBootTestContextBootstrapper=true"], contextCustomizers = [org.springframework.boot.test.context.filter.ExcludeFilterContextCustomizer@4c98a6d5, org.springframework.boot.test.json.DuplicateJsonObjectContextCustomizerFactory$DuplicateJsonObjectContextCustomizer@4d8126f, org.springframework.boot.test.mock.mockito.MockitoContextCustomizer@0, org.springframework.boot.test.web.client.TestRestTemplateContextCustomizer@2d2690f6, org.springframework.boot.test.web.reactor.netty.DisableReactorResourceFactoryGlobalResourcesContextCustomizerFactory$DisableReactorResourceFactoryGlobalResourcesContextCustomizerCustomizer@1ecfcbc9, org.springframework.boot.test.autoconfigure.OnFailureConditionReportContextCustomizerFactory$OnFailureConditionReportContextCustomizer@55cff952, org.springframework.boot.test.autoconfigure.actuate.observability.ObservabilityContextCustomizerFactory$DisableObservabilityContextCustomizer@1f, org.springframework.boot.test.autoconfigure.properties.PropertyMappingContextCustomizer@0, org.springframework.boot.test.autoconfigure.web.servlet.WebDriverContextCustomizer@9d200de, org.springframework.test.context.support.DynamicPropertiesContextCustomizer@0, org.springframework.boot.test.context.SpringBootTestAnnotation@c608711], resourceBasePath = "src/main/webapp", contextLoader = org.springframework.boot.test.context.SpringBootContextLoader, parent = null]
	at org.springframework.test.context.cache.DefaultCacheAwareContextLoaderDelegate.loadContext(DefaultCacheAwareContextLoaderDelegate.java:180) ~[spring-test-6.2.1.jar:6.2.1]
	at org.springframework.test.context.support.DefaultTestContext.getApplicationContext(DefaultTestContext.java:130) ~[spring-test-6.2.1.jar:6.2.1]
	at org.springframework.test.context.web.ServletTestExecutionListener.setUpRequestContextIfNecessary(ServletTestExecutionListener.java:191) ~[spring-test-6.2.1.jar:6.2.1]
	at org.springframework.test.context.web.ServletTestExecutionListener.prepareTestInstance(ServletTestExecutionListener.java:130) ~[spring-test-6.2.1.jar:6.2.1]
	at org.springframework.test.context.TestContextManager.prepareTestInstance(TestContextManager.java:260) ~[spring-test-6.2.1.jar:6.2.1]
	at org.springframework.test.context.junit.jupiter.SpringExtension.postProcessTestInstance(SpringExtension.java:160) ~[spring-test-6.2.1.jar:6.2.1]
	at org.junit.jupiter.engine.descriptor.ClassBasedTestDescriptor.lambda$invokeTestInstancePostProcessors$11(ClassBasedTestDescriptor.java:378) ~[junit-jupiter-engine-5.11.4.jar:5.11.4]
	at org.junit.jupiter.engine.descriptor.ClassBasedTestDescriptor.executeAndMaskThrowable(ClassBasedTestDescriptor.java:383) ~[junit-jupiter-engine-5.11.4.jar:5.11.4]
	at org.junit.jupiter.engine.descriptor.ClassBasedTestDescriptor.lambda$invokeTestInstancePostProcessors$12(ClassBasedTestDescriptor.java:378) ~[junit-jupiter-engine-5.11.4.jar:5.11.4]
	at java.base/java.util.stream.ForEachOps$ForEachOp$OfRef.accept(ForEachOps.java:184) ~[na:na]
	at java.base/java.util.stream.ReferencePipeline$3$1.accept(ReferencePipeline.java:197) ~[na:na]
	at java.base/java.util.stream.ReferencePipeline$2$1.accept(ReferencePipeline.java:179) ~[na:na]
	at java.base/java.util.stream.ReferencePipeline$3$1.accept(ReferencePipeline.java:197) ~[na:na]
	at java.base/java.util.ArrayList$ArrayListSpliterator.forEachRemaining(ArrayList.java:1708) ~[na:na]
	at java.base/java.util.stream.AbstractPipeline.copyInto(AbstractPipeline.java:509) ~[na:na]
	at java.base/java.util.stream.AbstractPipeline.wrapAndCopyInto(AbstractPipeline.java:499) ~[na:na]
	at java.base/java.util.stream.ForEachOps$ForEachOp.evaluateSequential(ForEachOps.java:151) ~[na:na]
	at java.base/java.util.stream.ForEachOps$ForEachOp$OfRef.evaluateSequential(ForEachOps.java:174) ~[na:na]
	at java.base/java.util.stream.AbstractPipeline.evaluate(AbstractPipeline.java:234) ~[na:na]
	at java.base/java.util.stream.ReferencePipeline.forEach(ReferencePipeline.java:596) ~[na:na]
	at org.junit.jupiter.engine.descriptor.ClassBasedTestDescriptor.invokeTestInstancePostProcessors(ClassBasedTestDescriptor.java:377) ~[junit-jupiter-engine-5.11.4.jar:5.11.4]
	at org.junit.jupiter.engine.descriptor.ClassBasedTestDescriptor.lambda$instantiateAndPostProcessTestInstance$7(ClassBasedTestDescriptor.java:290) ~[junit-jupiter-engine-5.11.4.jar:5.11.4]
	at org.junit.platform.engine.support.hierarchical.ThrowableCollector.execute(ThrowableCollector.java:73) ~[junit-platform-engine-1.11.4.jar:1.11.4]
	at org.junit.jupiter.engine.descriptor.ClassBasedTestDescriptor.instantiateAndPostProcessTestInstance(ClassBasedTestDescriptor.java:289) ~[junit-jupiter-engine-5.11.4.jar:5.11.4]
	at org.junit.jupiter.engine.descriptor.ClassBasedTestDescriptor.lambda$testInstancesProvider$5(ClassBasedTestDescriptor.java:279) ~[junit-jupiter-engine-5.11.4.jar:5.11.4]
	at java.base/java.util.Optional.orElseGet(Optional.java:364) ~[na:na]
	at org.junit.jupiter.engine.descriptor.ClassBasedTestDescriptor.lambda$testInstancesProvider$6(ClassBasedTestDescriptor.java:278) ~[junit-jupiter-engine-5.11.4.jar:5.11.4]
	at org.junit.jupiter.engine.execution.TestInstancesProvider.getTestInstances(TestInstancesProvider.java:31) ~[junit-jupiter-engine-5.11.4.jar:5.11.4]
	at org.junit.jupiter.engine.descriptor.TestMethodTestDescriptor.lambda$prepare$1(TestMethodTestDescriptor.java:105) ~[junit-jupiter-engine-5.11.4.jar:5.11.4]
	at org.junit.platform.engine.support.hierarchical.ThrowableCollector.execute(ThrowableCollector.java:73) ~[junit-platform-engine-1.11.4.jar:1.11.4]
	at org.junit.jupiter.engine.descriptor.TestMethodTestDescriptor.prepare(TestMethodTestDescriptor.java:104) ~[junit-jupiter-engine-5.11.4.jar:5.11.4]
	at org.junit.jupiter.engine.descriptor.TestMethodTestDescriptor.prepare(TestMethodTestDescriptor.java:68) ~[junit-jupiter-engine-5.11.4.jar:5.11.4]
	at org.junit.platform.engine.support.hierarchical.NodeTestTask.lambda$prepare$2(NodeTestTask.java:128) ~[junit-platform-engine-1.11.4.jar:1.11.4]
	at org.junit.platform.engine.support.hierarchical.ThrowableCollector.execute(ThrowableCollector.java:73) ~[junit-platform-engine-1.11.4.jar:1.11.4]
	at org.junit.platform.engine.support.hierarchical.NodeTestTask.prepare(NodeTestTask.java:128) ~[junit-platform-engine-1.11.4.jar:1.11.4]
	at org.junit.platform.engine.support.hierarchical.NodeTestTask.execute(NodeTestTask.java:95) ~[junit-platform-engine-1.11.4.jar:1.11.4]
	at java.base/java.util.ArrayList.forEach(ArrayList.java:1596) ~[na:na]
	at org.junit.platform.engine.support.hierarchical.SameThreadHierarchicalTestExecutorService.invokeAll(SameThreadHierarchicalTestExecutorService.java:41) ~[junit-platform-engine-1.11.4.jar:1.11.4]
	at org.junit.platform.engine.support.hierarchical.NodeTestTask.lambda$executeRecursively$6(NodeTestTask.java:160) ~[junit-platform-engine-1.11.4.jar:1.11.4]
	at org.junit.platform.engine.support.hierarchical.ThrowableCollector.execute(ThrowableCollector.java:73) ~[junit-platform-engine-1.11.4.jar:1.11.4]
	at org.junit.platform.engine.support.hierarchical.NodeTestTask.lambda$executeRecursively$8(NodeTestTask.java:146) ~[junit-platform-engine-1.11.4.jar:1.11.4]
	at org.junit.platform.engine.support.hierarchical.Node.around(Node.java:137) ~[junit-platform-engine-1.11.4.jar:1.11.4]
	at org.junit.platform.engine.support.hierarchical.NodeTestTask.lambda$executeRecursively$9(NodeTestTask.java:144) ~[junit-platform-engine-1.11.4.jar:1.11.4]
	at org.junit.platform.engine.support.hierarchical.ThrowableCollector.execute(ThrowableCollector.java:73) ~[junit-platform-engine-1.11.4.jar:1.11.4]
	at org.junit.platform.engine.support.hierarchical.NodeTestTask.executeRecursively(NodeTestTask.java:143) ~[junit-platform-engine-1.11.4.jar:1.11.4]
	at org.junit.platform.engine.support.hierarchical.NodeTestTask.execute(NodeTestTask.java:100) ~[junit-platform-engine-1.11.4.jar:1.11.4]
	at java.base/java.util.ArrayList.forEach(ArrayList.java:1596) ~[na:na]
	at org.junit.platform.engine.support.hierarchical.SameThreadHierarchicalTestExecutorService.invokeAll(SameThreadHierarchicalTestExecutorService.java:41) ~[junit-platform-engine-1.11.4.jar:1.11.4]
	at org.junit.platform.engine.support.hierarchical.NodeTestTask.lambda$executeRecursively$6(NodeTestTask.java:160) ~[junit-platform-engine-1.11.4.jar:1.11.4]
	at org.junit.platform.engine.support.hierarchical.ThrowableCollector.execute(ThrowableCollector.java:73) ~[junit-platform-engine-1.11.4.jar:1.11.4]
	at org.junit.platform.engine.support.hierarchical.NodeTestTask.lambda$executeRecursively$8(NodeTestTask.java:146) ~[junit-platform-engine-1.11.4.jar:1.11.4]
	at org.junit.platform.engine.support.hierarchical.Node.around(Node.java:137) ~[junit-platform-engine-1.11.4.jar:1.11.4]
	at org.junit.platform.engine.support.hierarchical.NodeTestTask.lambda$executeRecursively$9(NodeTestTask.java:144) ~[junit-platform-engine-1.11.4.jar:1.11.4]
	at org.junit.platform.engine.support.hierarchical.ThrowableCollector.execute(ThrowableCollector.java:73) ~[junit-platform-engine-1.11.4.jar:1.11.4]
	at org.junit.platform.engine.support.hierarchical.NodeTestTask.executeRecursively(NodeTestTask.java:143) ~[junit-platform-engine-1.11.4.jar:1.11.4]
	at org.junit.platform.engine.support.hierarchical.NodeTestTask.execute(NodeTestTask.java:100) ~[junit-platform-engine-1.11.4.jar:1.11.4]
	at org.junit.platform.engine.support.hierarchical.SameThreadHierarchicalTestExecutorService.submit(SameThreadHierarchicalTestExecutorService.java:35) ~[junit-platform-engine-1.11.4.jar:1.11.4]
	at org.junit.platform.engine.support.hierarchical.HierarchicalTestExecutor.execute(HierarchicalTestExecutor.java:57) ~[junit-platform-engine-1.11.4.jar:1.11.4]
	at org.junit.platform.engine.support.hierarchical.HierarchicalTestEngine.execute(HierarchicalTestEngine.java:54) ~[junit-platform-engine-1.11.4.jar:1.11.4]
	at org.junit.platform.launcher.core.EngineExecutionOrchestrator.execute(EngineExecutionOrchestrator.java:198) ~[junit-platform-launcher-1.11.4.jar:1.11.4]
	at org.junit.platform.launcher.core.EngineExecutionOrchestrator.execute(EngineExecutionOrchestrator.java:169) ~[junit-platform-launcher-1.11.4.jar:1.11.4]
	at org.junit.platform.launcher.core.EngineExecutionOrchestrator.execute(EngineExecutionOrchestrator.java:93) ~[junit-platform-launcher-1.11.4.jar:1.11.4]
	at org.junit.platform.launcher.core.EngineExecutionOrchestrator.lambda$execute$0(EngineExecutionOrchestrator.java:58) ~[junit-platform-launcher-1.11.4.jar:1.11.4]
	at org.junit.platform.launcher.core.EngineExecutionOrchestrator.withInterceptedStreams(EngineExecutionOrchestrator.java:141) ~[junit-platform-launcher-1.11.4.jar:1.11.4]
	at org.junit.platform.launcher.core.EngineExecutionOrchestrator.execute(EngineExecutionOrchestrator.java:57) ~[junit-platform-launcher-1.11.4.jar:1.11.4]
	at org.junit.platform.launcher.core.DefaultLauncher.execute(DefaultLauncher.java:103) ~[junit-platform-launcher-1.11.4.jar:1.11.4]
	at org.junit.platform.launcher.core.DefaultLauncher.execute(DefaultLauncher.java:85) ~[junit-platform-launcher-1.11.4.jar:1.11.4]
	at org.junit.platform.launcher.core.DelegatingLauncher.execute(DelegatingLauncher.java:47) ~[junit-platform-launcher-1.11.4.jar:1.11.4]
	at org.apache.maven.surefire.junitplatform.LazyLauncher.execute(LazyLauncher.java:56) ~[surefire-junit-platform-3.5.2.jar:3.5.2]
	at org.apache.maven.surefire.junitplatform.JUnitPlatformProvider.execute(JUnitPlatformProvider.java:184) ~[surefire-junit-platform-3.5.2.jar:3.5.2]
	at org.apache.maven.surefire.junitplatform.JUnitPlatformProvider.invokeAllTests(JUnitPlatformProvider.java:148) ~[surefire-junit-platform-3.5.2.jar:3.5.2]
	at org.apache.maven.surefire.junitplatform.JUnitPlatformProvider.invoke(JUnitPlatformProvider.java:122) ~[surefire-junit-platform-3.5.2.jar:3.5.2]
	at org.apache.maven.surefire.booter.ForkedBooter.runSuitesInProcess(ForkedBooter.java:385) ~[surefire-booter-3.5.2.jar:3.5.2]
	at org.apache.maven.surefire.booter.ForkedBooter.execute(ForkedBooter.java:162) ~[surefire-booter-3.5.2.jar:3.5.2]
	at org.apache.maven.surefire.booter.ForkedBooter.run(ForkedBooter.java:507) ~[surefire-booter-3.5.2.jar:3.5.2]
	at org.apache.maven.surefire.booter.ForkedBooter.main(ForkedBooter.java:495) ~[surefire-booter-3.5.2.jar:3.5.2]
Caused by: org.springframework.beans.factory.UnsatisfiedDependencyException: Error creating bean with name 'authorController' defined in file [/home/luciano/Programming/personal/spring-rest-docs-demo/target/classes/com/example/demo/controllers/AuthorController.class]: Unsatisfied dependency expressed through constructor parameter 0: Error creating bean with name 'authorService' defined in file [/home/luciano/Programming/personal/spring-rest-docs-demo/target/classes/com/example/demo/services/AuthorService.class]: Unsatisfied dependency expressed through constructor parameter 1: No qualifying bean of type 'com.example.demo.models.mappers.AuthorMapper' available: expected at least 1 bean which qualifies as autowire candidate. Dependency annotations: {}
	at org.springframework.beans.factory.support.ConstructorResolver.createArgumentArray(ConstructorResolver.java:804) ~[spring-beans-6.2.1.jar:6.2.1]
	at org.springframework.beans.factory.support.ConstructorResolver.autowireConstructor(ConstructorResolver.java:240) ~[spring-beans-6.2.1.jar:6.2.1]
	at org.springframework.beans.factory.support.AbstractAutowireCapableBeanFactory.autowireConstructor(AbstractAutowireCapableBeanFactory.java:1377) ~[spring-beans-6.2.1.jar:6.2.1]
	at org.springframework.beans.factory.support.AbstractAutowireCapableBeanFactory.createBeanInstance(AbstractAutowireCapableBeanFactory.java:1214) ~[spring-beans-6.2.1.jar:6.2.1]
	at org.springframework.beans.factory.support.AbstractAutowireCapableBeanFactory.doCreateBean(AbstractAutowireCapableBeanFactory.java:563) ~[spring-beans-6.2.1.jar:6.2.1]
	at org.springframework.beans.factory.support.AbstractAutowireCapableBeanFactory.createBean(AbstractAutowireCapableBeanFactory.java:523) ~[spring-beans-6.2.1.jar:6.2.1]
	at org.springframework.beans.factory.support.AbstractBeanFactory.lambda$doGetBean$0(AbstractBeanFactory.java:336) ~[spring-beans-6.2.1.jar:6.2.1]
	at org.springframework.beans.factory.support.DefaultSingletonBeanRegistry.getSingleton(DefaultSingletonBeanRegistry.java:289) ~[spring-beans-6.2.1.jar:6.2.1]
	at org.springframework.beans.factory.support.AbstractBeanFactory.doGetBean(AbstractBeanFactory.java:334) ~[spring-beans-6.2.1.jar:6.2.1]
	at org.springframework.beans.factory.support.AbstractBeanFactory.getBean(AbstractBeanFactory.java:199) ~[spring-beans-6.2.1.jar:6.2.1]
	at org.springframework.beans.factory.support.DefaultListableBeanFactory.instantiateSingleton(DefaultListableBeanFactory.java:1122) ~[spring-beans-6.2.1.jar:6.2.1]
	at org.springframework.beans.factory.support.DefaultListableBeanFactory.preInstantiateSingleton(DefaultListableBeanFactory.java:1093) ~[spring-beans-6.2.1.jar:6.2.1]
	at org.springframework.beans.factory.support.DefaultListableBeanFactory.preInstantiateSingletons(DefaultListableBeanFactory.java:1030) ~[spring-beans-6.2.1.jar:6.2.1]
	at org.springframework.context.support.AbstractApplicationContext.finishBeanFactoryInitialization(AbstractApplicationContext.java:987) ~[spring-context-6.2.1.jar:6.2.1]
	at org.springframework.context.support.AbstractApplicationContext.refresh(AbstractApplicationContext.java:627) ~[spring-context-6.2.1.jar:6.2.1]
	at org.springframework.boot.SpringApplication.refresh(SpringApplication.java:752) ~[spring-boot-3.4.1.jar:3.4.1]
	at org.springframework.boot.SpringApplication.refreshContext(SpringApplication.java:439) ~[spring-boot-3.4.1.jar:3.4.1]
	at org.springframework.boot.SpringApplication.run(SpringApplication.java:318) ~[spring-boot-3.4.1.jar:3.4.1]
	at org.springframework.boot.test.context.SpringBootContextLoader.lambda$loadContext$3(SpringBootContextLoader.java:137) ~[spring-boot-test-3.4.1.jar:3.4.1]
	at org.springframework.util.function.ThrowingSupplier.get(ThrowingSupplier.java:58) ~[spring-core-6.2.1.jar:6.2.1]
	at org.springframework.util.function.ThrowingSupplier.get(ThrowingSupplier.java:46) ~[spring-core-6.2.1.jar:6.2.1]
	at org.springframework.boot.SpringApplication.withHook(SpringApplication.java:1461) ~[spring-boot-3.4.1.jar:3.4.1]
	at org.springframework.boot.test.context.SpringBootContextLoader$ContextLoaderHook.run(SpringBootContextLoader.java:553) ~[spring-boot-test-3.4.1.jar:3.4.1]
	at org.springframework.boot.test.context.SpringBootContextLoader.loadContext(SpringBootContextLoader.java:137) ~[spring-boot-test-3.4.1.jar:3.4.1]
	at org.springframework.boot.test.context.SpringBootContextLoader.loadContext(SpringBootContextLoader.java:108) ~[spring-boot-test-3.4.1.jar:3.4.1]
	at org.springframework.test.context.cache.DefaultCacheAwareContextLoaderDelegate.loadContextInternal(DefaultCacheAwareContextLoaderDelegate.java:225) ~[spring-test-6.2.1.jar:6.2.1]
	at org.springframework.test.context.cache.DefaultCacheAwareContextLoaderDelegate.loadContext(DefaultCacheAwareContextLoaderDelegate.java:152) ~[spring-test-6.2.1.jar:6.2.1]
	... 75 common frames omitted
Caused by: org.springframework.beans.factory.UnsatisfiedDependencyException: Error creating bean with name 'authorService' defined in file [/home/luciano/Programming/personal/spring-rest-docs-demo/target/classes/com/example/demo/services/AuthorService.class]: Unsatisfied dependency expressed through constructor parameter 1: No qualifying bean of type 'com.example.demo.models.mappers.AuthorMapper' available: expected at least 1 bean which qualifies as autowire candidate. Dependency annotations: {}
	at org.springframework.beans.factory.support.ConstructorResolver.createArgumentArray(ConstructorResolver.java:804) ~[spring-beans-6.2.1.jar:6.2.1]
	at org.springframework.beans.factory.support.ConstructorResolver.autowireConstructor(ConstructorResolver.java:240) ~[spring-beans-6.2.1.jar:6.2.1]
	at org.springframework.beans.factory.support.AbstractAutowireCapableBeanFactory.autowireConstructor(AbstractAutowireCapableBeanFactory.java:1377) ~[spring-beans-6.2.1.jar:6.2.1]
	at org.springframework.beans.factory.support.AbstractAutowireCapableBeanFactory.createBeanInstance(AbstractAutowireCapableBeanFactory.java:1214) ~[spring-beans-6.2.1.jar:6.2.1]
	at org.springframework.beans.factory.support.AbstractAutowireCapableBeanFactory.doCreateBean(AbstractAutowireCapableBeanFactory.java:563) ~[spring-beans-6.2.1.jar:6.2.1]
	at org.springframework.beans.factory.support.AbstractAutowireCapableBeanFactory.createBean(AbstractAutowireCapableBeanFactory.java:523) ~[spring-beans-6.2.1.jar:6.2.1]
	at org.springframework.beans.factory.support.AbstractBeanFactory.lambda$doGetBean$0(AbstractBeanFactory.java:336) ~[spring-beans-6.2.1.jar:6.2.1]
	at org.springframework.beans.factory.support.DefaultSingletonBeanRegistry.getSingleton(DefaultSingletonBeanRegistry.java:289) ~[spring-beans-6.2.1.jar:6.2.1]
	at org.springframework.beans.factory.support.AbstractBeanFactory.doGetBean(AbstractBeanFactory.java:334) ~[spring-beans-6.2.1.jar:6.2.1]
	at org.springframework.beans.factory.support.AbstractBeanFactory.getBean(AbstractBeanFactory.java:199) ~[spring-beans-6.2.1.jar:6.2.1]
	at org.springframework.beans.factory.support.DefaultListableBeanFactory.doResolveDependency(DefaultListableBeanFactory.java:1573) ~[spring-beans-6.2.1.jar:6.2.1]
	at org.springframework.beans.factory.support.DefaultListableBeanFactory.resolveDependency(DefaultListableBeanFactory.java:1519) ~[spring-beans-6.2.1.jar:6.2.1]
	at org.springframework.beans.factory.support.ConstructorResolver.resolveAutowiredArgument(ConstructorResolver.java:913) ~[spring-beans-6.2.1.jar:6.2.1]
	at org.springframework.beans.factory.support.ConstructorResolver.createArgumentArray(ConstructorResolver.java:791) ~[spring-beans-6.2.1.jar:6.2.1]
	... 101 common frames omitted
Caused by: org.springframework.beans.factory.NoSuchBeanDefinitionException: No qualifying bean of type 'com.example.demo.models.mappers.AuthorMapper' available: expected at least 1 bean which qualifies as autowire candidate. Dependency annotations: {}
	at org.springframework.beans.factory.support.DefaultListableBeanFactory.raiseNoMatchingBeanFound(DefaultListableBeanFactory.java:2144) ~[spring-beans-6.2.1.jar:6.2.1]
	at org.springframework.beans.factory.support.DefaultListableBeanFactory.doResolveDependency(DefaultListableBeanFactory.java:1594) ~[spring-beans-6.2.1.jar:6.2.1]
	at org.springframework.beans.factory.support.DefaultListableBeanFactory.resolveDependency(DefaultListableBeanFactory.java:1519) ~[spring-beans-6.2.1.jar:6.2.1]
	at org.springframework.beans.factory.support.ConstructorResolver.resolveAutowiredArgument(ConstructorResolver.java:913) ~[spring-beans-6.2.1.jar:6.2.1]
	at org.springframework.beans.factory.support.ConstructorResolver.createArgumentArray(ConstructorResolver.java:791) ~[spring-beans-6.2.1.jar:6.2.1]
	... 114 common frames omitted

[ERROR] Tests run: 1, Failures: 0, Errors: 1, Skipped: 0, Time elapsed: 1.635 s <<< FAILURE! -- in com.example.demo.DemoApplicationTests
[ERROR] com.example.demo.DemoApplicationTests.contextLoads -- Time elapsed: 0.002 s <<< ERROR!
java.lang.IllegalStateException: Failed to load ApplicationContext for [WebMergedContextConfiguration@4dab3e26 testClass = com.example.demo.DemoApplicationTests, locations = [], classes = [com.example.demo.DemoApplication], contextInitializerClasses = [], activeProfiles = [], propertySourceDescriptors = [], propertySourceProperties = ["org.springframework.boot.test.context.SpringBootTestContextBootstrapper=true"], contextCustomizers = [org.springframework.boot.test.context.filter.ExcludeFilterContextCustomizer@4c98a6d5, org.springframework.boot.test.json.DuplicateJsonObjectContextCustomizerFactory$DuplicateJsonObjectContextCustomizer@4d8126f, org.springframework.boot.test.mock.mockito.MockitoContextCustomizer@0, org.springframework.boot.test.web.client.TestRestTemplateContextCustomizer@2d2690f6, org.springframework.boot.test.web.reactor.netty.DisableReactorResourceFactoryGlobalResourcesContextCustomizerFactory$DisableReactorResourceFactoryGlobalResourcesContextCustomizerCustomizer@1ecfcbc9, org.springframework.boot.test.autoconfigure.OnFailureConditionReportContextCustomizerFactory$OnFailureConditionReportContextCustomizer@55cff952, org.springframework.boot.test.autoconfigure.actuate.observability.ObservabilityContextCustomizerFactory$DisableObservabilityContextCustomizer@1f, org.springframework.boot.test.autoconfigure.properties.PropertyMappingContextCustomizer@0, org.springframework.boot.test.autoconfigure.web.servlet.WebDriverContextCustomizer@9d200de, org.springframework.test.context.support.DynamicPropertiesContextCustomizer@0, org.springframework.boot.test.context.SpringBootTestAnnotation@c608711], resourceBasePath = "src/main/webapp", contextLoader = org.springframework.boot.test.context.SpringBootContextLoader, parent = null]
	at org.springframework.test.context.cache.DefaultCacheAwareContextLoaderDelegate.loadContext(DefaultCacheAwareContextLoaderDelegate.java:180)
	at org.springframework.test.context.support.DefaultTestContext.getApplicationContext(DefaultTestContext.java:130)
	at org.springframework.test.context.web.ServletTestExecutionListener.setUpRequestContextIfNecessary(ServletTestExecutionListener.java:191)
	at org.springframework.test.context.web.ServletTestExecutionListener.prepareTestInstance(ServletTestExecutionListener.java:130)
	at org.springframework.test.context.TestContextManager.prepareTestInstance(TestContextManager.java:260)
	at org.springframework.test.context.junit.jupiter.SpringExtension.postProcessTestInstance(SpringExtension.java:160)
	at java.base/java.util.stream.ForEachOps$ForEachOp$OfRef.accept(ForEachOps.java:184)
	at java.base/java.util.stream.ReferencePipeline$3$1.accept(ReferencePipeline.java:197)
	at java.base/java.util.stream.ReferencePipeline$2$1.accept(ReferencePipeline.java:179)
	at java.base/java.util.stream.ReferencePipeline$3$1.accept(ReferencePipeline.java:197)
	at java.base/java.util.ArrayList$ArrayListSpliterator.forEachRemaining(ArrayList.java:1708)
	at java.base/java.util.stream.AbstractPipeline.copyInto(AbstractPipeline.java:509)
	at java.base/java.util.stream.AbstractPipeline.wrapAndCopyInto(AbstractPipeline.java:499)
	at java.base/java.util.stream.ForEachOps$ForEachOp.evaluateSequential(ForEachOps.java:151)
	at java.base/java.util.stream.ForEachOps$ForEachOp$OfRef.evaluateSequential(ForEachOps.java:174)
	at java.base/java.util.stream.AbstractPipeline.evaluate(AbstractPipeline.java:234)
	at java.base/java.util.stream.ReferencePipeline.forEach(ReferencePipeline.java:596)
	at java.base/java.util.Optional.orElseGet(Optional.java:364)
	at java.base/java.util.ArrayList.forEach(ArrayList.java:1596)
	at java.base/java.util.ArrayList.forEach(ArrayList.java:1596)
Caused by: org.springframework.beans.factory.UnsatisfiedDependencyException: Error creating bean with name 'authorController' defined in file [/home/luciano/Programming/personal/spring-rest-docs-demo/target/classes/com/example/demo/controllers/AuthorController.class]: Unsatisfied dependency expressed through constructor parameter 0: Error creating bean with name 'authorService' defined in file [/home/luciano/Programming/personal/spring-rest-docs-demo/target/classes/com/example/demo/services/AuthorService.class]: Unsatisfied dependency expressed through constructor parameter 1: No qualifying bean of type 'com.example.demo.models.mappers.AuthorMapper' available: expected at least 1 bean which qualifies as autowire candidate. Dependency annotations: {}
	at org.springframework.beans.factory.support.ConstructorResolver.createArgumentArray(ConstructorResolver.java:804)
	at org.springframework.beans.factory.support.ConstructorResolver.autowireConstructor(ConstructorResolver.java:240)
	at org.springframework.beans.factory.support.AbstractAutowireCapableBeanFactory.autowireConstructor(AbstractAutowireCapableBeanFactory.java:1377)
	at org.springframework.beans.factory.support.AbstractAutowireCapableBeanFactory.createBeanInstance(AbstractAutowireCapableBeanFactory.java:1214)
	at org.springframework.beans.factory.support.AbstractAutowireCapableBeanFactory.doCreateBean(AbstractAutowireCapableBeanFactory.java:563)
	at org.springframework.beans.factory.support.AbstractAutowireCapableBeanFactory.createBean(AbstractAutowireCapableBeanFactory.java:523)
	at org.springframework.beans.factory.support.AbstractBeanFactory.lambda$doGetBean$0(AbstractBeanFactory.java:336)
	at org.springframework.beans.factory.support.DefaultSingletonBeanRegistry.getSingleton(DefaultSingletonBeanRegistry.java:289)
	at org.springframework.beans.factory.support.AbstractBeanFactory.doGetBean(AbstractBeanFactory.java:334)
	at org.springframework.beans.factory.support.AbstractBeanFactory.getBean(AbstractBeanFactory.java:199)
	at org.springframework.beans.factory.support.DefaultListableBeanFactory.instantiateSingleton(DefaultListableBeanFactory.java:1122)
	at org.springframework.beans.factory.support.DefaultListableBeanFactory.preInstantiateSingleton(DefaultListableBeanFactory.java:1093)
	at org.springframework.beans.factory.support.DefaultListableBeanFactory.preInstantiateSingletons(DefaultListableBeanFactory.java:1030)
	at org.springframework.context.support.AbstractApplicationContext.finishBeanFactoryInitialization(AbstractApplicationContext.java:987)
	at org.springframework.context.support.AbstractApplicationContext.refresh(AbstractApplicationContext.java:627)
	at org.springframework.boot.SpringApplication.refresh(SpringApplication.java:752)
	at org.springframework.boot.SpringApplication.refreshContext(SpringApplication.java:439)
	at org.springframework.boot.SpringApplication.run(SpringApplication.java:318)
	at org.springframework.boot.test.context.SpringBootContextLoader.lambda$loadContext$3(SpringBootContextLoader.java:137)
	at org.springframework.util.function.ThrowingSupplier.get(ThrowingSupplier.java:58)
	at org.springframework.util.function.ThrowingSupplier.get(ThrowingSupplier.java:46)
	at org.springframework.boot.SpringApplication.withHook(SpringApplication.java:1461)
	at org.springframework.boot.test.context.SpringBootContextLoader$ContextLoaderHook.run(SpringBootContextLoader.java:553)
	at org.springframework.boot.test.context.SpringBootContextLoader.loadContext(SpringBootContextLoader.java:137)
	at org.springframework.boot.test.context.SpringBootContextLoader.loadContext(SpringBootContextLoader.java:108)
	at org.springframework.test.context.cache.DefaultCacheAwareContextLoaderDelegate.loadContextInternal(DefaultCacheAwareContextLoaderDelegate.java:225)
	at org.springframework.test.context.cache.DefaultCacheAwareContextLoaderDelegate.loadContext(DefaultCacheAwareContextLoaderDelegate.java:152)
	... 19 more
Caused by: org.springframework.beans.factory.UnsatisfiedDependencyException: Error creating bean with name 'authorService' defined in file [/home/luciano/Programming/personal/spring-rest-docs-demo/target/classes/com/example/demo/services/AuthorService.class]: Unsatisfied dependency expressed through constructor parameter 1: No qualifying bean of type 'com.example.demo.models.mappers.AuthorMapper' available: expected at least 1 bean which qualifies as autowire candidate. Dependency annotations: {}
	at org.springframework.beans.factory.support.ConstructorResolver.createArgumentArray(ConstructorResolver.java:804)
	at org.springframework.beans.factory.support.ConstructorResolver.autowireConstructor(ConstructorResolver.java:240)
	at org.springframework.beans.factory.support.AbstractAutowireCapableBeanFactory.autowireConstructor(AbstractAutowireCapableBeanFactory.java:1377)
	at org.springframework.beans.factory.support.AbstractAutowireCapableBeanFactory.createBeanInstance(AbstractAutowireCapableBeanFactory.java:1214)
	at org.springframework.beans.factory.support.AbstractAutowireCapableBeanFactory.doCreateBean(AbstractAutowireCapableBeanFactory.java:563)
	at org.springframework.beans.factory.support.AbstractAutowireCapableBeanFactory.createBean(AbstractAutowireCapableBeanFactory.java:523)
	at org.springframework.beans.factory.support.AbstractBeanFactory.lambda$doGetBean$0(AbstractBeanFactory.java:336)
	at org.springframework.beans.factory.support.DefaultSingletonBeanRegistry.getSingleton(DefaultSingletonBeanRegistry.java:289)
	at org.springframework.beans.factory.support.AbstractBeanFactory.doGetBean(AbstractBeanFactory.java:334)
	at org.springframework.beans.factory.support.AbstractBeanFactory.getBean(AbstractBeanFactory.java:199)
	at org.springframework.beans.factory.support.DefaultListableBeanFactory.doResolveDependency(DefaultListableBeanFactory.java:1573)
	at org.springframework.beans.factory.support.DefaultListableBeanFactory.resolveDependency(DefaultListableBeanFactory.java:1519)
	at org.springframework.beans.factory.support.ConstructorResolver.resolveAutowiredArgument(ConstructorResolver.java:913)
	at org.springframework.beans.factory.support.ConstructorResolver.createArgumentArray(ConstructorResolver.java:791)
	... 45 more
Caused by: org.springframework.beans.factory.NoSuchBeanDefinitionException: No qualifying bean of type 'com.example.demo.models.mappers.AuthorMapper' available: expected at least 1 bean which qualifies as autowire candidate. Dependency annotations: {}
	at org.springframework.beans.factory.support.DefaultListableBeanFactory.raiseNoMatchingBeanFound(DefaultListableBeanFactory.java:2144)
	at org.springframework.beans.factory.support.DefaultListableBeanFactory.doResolveDependency(DefaultListableBeanFactory.java:1594)
	at org.springframework.beans.factory.support.DefaultListableBeanFactory.resolveDependency(DefaultListableBeanFactory.java:1519)
	at org.springframework.beans.factory.support.ConstructorResolver.resolveAutowiredArgument(ConstructorResolver.java:913)
	at org.springframework.beans.factory.support.ConstructorResolver.createArgumentArray(ConstructorResolver.java:791)
	... 58 more

[INFO] Running com.example.demo.service.AuthorServiceTests
[ERROR] Tests run: 5, Failures: 0, Errors: 5, Skipped: 0, Time elapsed: 0.011 s <<< FAILURE! -- in com.example.demo.service.AuthorServiceTests
[ERROR] com.example.demo.service.AuthorServiceTests.delete_success -- Time elapsed: 0.003 s <<< ERROR!
java.lang.RuntimeException: java.lang.reflect.InvocationTargetException
	at org.mapstruct.factory.Mappers.doGetMapper(Mappers.java:91)
	at org.mapstruct.factory.Mappers.getMapper(Mappers.java:69)
	at org.mapstruct.factory.Mappers.getMapper(Mappers.java:58)
	at com.example.demo.service.AuthorServiceTests.<init>(AuthorServiceTests.java:31)
	at java.base/java.lang.reflect.Constructor.newInstanceWithCaller(Constructor.java:502)
	at java.base/java.lang.reflect.Constructor.newInstance(Constructor.java:486)
	at java.base/java.util.Optional.orElseGet(Optional.java:364)
	at java.base/java.util.ArrayList.forEach(ArrayList.java:1596)
	at java.base/java.util.ArrayList.forEach(ArrayList.java:1596)
Caused by: java.lang.reflect.InvocationTargetException
	at java.base/jdk.internal.reflect.DirectConstructorHandleAccessor.newInstance(DirectConstructorHandleAccessor.java:74)
	at java.base/java.lang.reflect.Constructor.newInstanceWithCaller(Constructor.java:502)
	at java.base/java.lang.reflect.Constructor.newInstance(Constructor.java:486)
	at org.mapstruct.factory.Mappers.doGetMapper(Mappers.java:85)
	... 8 more
Caused by: java.lang.Error: Unresolved compilation problems: 
	The import com.example.demo.models.dtos cannot be resolved
	The import com.example.demo.models.entities cannot be resolved
	AuthorMapper cannot be resolved to a type
	AuthorDTO cannot be resolved to a type
	AuthorEntity cannot be resolved to a type
	AuthorDTO cannot be resolved to a type
	AuthorDTO cannot be resolved to a type
	AuthorEntity cannot be resolved to a type
	AuthorDTO cannot be resolved to a type
	AuthorEntity cannot be resolved to a type
	AuthorEntity cannot be resolved to a type

	at com.example.demo.models.mappers.AuthorMapperImpl.<init>(AuthorMapperImpl.java:3)
	at java.base/jdk.internal.reflect.DirectConstructorHandleAccessor.newInstance(DirectConstructorHandleAccessor.java:62)
	... 11 more

[ERROR] com.example.demo.service.AuthorServiceTests.read_all_success -- Time elapsed: 0.001 s <<< ERROR!
java.lang.RuntimeException: java.lang.reflect.InvocationTargetException
	at org.mapstruct.factory.Mappers.doGetMapper(Mappers.java:91)
	at org.mapstruct.factory.Mappers.getMapper(Mappers.java:69)
	at org.mapstruct.factory.Mappers.getMapper(Mappers.java:58)
	at com.example.demo.service.AuthorServiceTests.<init>(AuthorServiceTests.java:31)
	at java.base/java.lang.reflect.Constructor.newInstanceWithCaller(Constructor.java:502)
	at java.base/java.lang.reflect.Constructor.newInstance(Constructor.java:486)
	at java.base/java.util.Optional.orElseGet(Optional.java:364)
	at java.base/java.util.ArrayList.forEach(ArrayList.java:1596)
	at java.base/java.util.ArrayList.forEach(ArrayList.java:1596)
Caused by: java.lang.reflect.InvocationTargetException
	at java.base/jdk.internal.reflect.DirectConstructorHandleAccessor.newInstance(DirectConstructorHandleAccessor.java:74)
	at java.base/java.lang.reflect.Constructor.newInstanceWithCaller(Constructor.java:502)
	at java.base/java.lang.reflect.Constructor.newInstance(Constructor.java:486)
	at org.mapstruct.factory.Mappers.doGetMapper(Mappers.java:85)
	... 8 more
Caused by: java.lang.Error: Unresolved compilation problems: 
	The import com.example.demo.models.dtos cannot be resolved
	The import com.example.demo.models.entities cannot be resolved
	AuthorMapper cannot be resolved to a type
	AuthorDTO cannot be resolved to a type
	AuthorEntity cannot be resolved to a type
	AuthorDTO cannot be resolved to a type
	AuthorDTO cannot be resolved to a type
	AuthorEntity cannot be resolved to a type
	AuthorDTO cannot be resolved to a type
	AuthorEntity cannot be resolved to a type
	AuthorEntity cannot be resolved to a type

	at com.example.demo.models.mappers.AuthorMapperImpl.<init>(AuthorMapperImpl.java:3)
	at java.base/jdk.internal.reflect.DirectConstructorHandleAccessor.newInstance(DirectConstructorHandleAccessor.java:62)
	... 11 more

[ERROR] com.example.demo.service.AuthorServiceTests.update_fail_when_not_found -- Time elapsed: 0.001 s <<< ERROR!
java.lang.RuntimeException: java.lang.reflect.InvocationTargetException
	at org.mapstruct.factory.Mappers.doGetMapper(Mappers.java:91)
	at org.mapstruct.factory.Mappers.getMapper(Mappers.java:69)
	at org.mapstruct.factory.Mappers.getMapper(Mappers.java:58)
	at com.example.demo.service.AuthorServiceTests.<init>(AuthorServiceTests.java:31)
	at java.base/java.lang.reflect.Constructor.newInstanceWithCaller(Constructor.java:502)
	at java.base/java.lang.reflect.Constructor.newInstance(Constructor.java:486)
	at java.base/java.util.Optional.orElseGet(Optional.java:364)
	at java.base/java.util.ArrayList.forEach(ArrayList.java:1596)
	at java.base/java.util.ArrayList.forEach(ArrayList.java:1596)
Caused by: java.lang.reflect.InvocationTargetException
	at java.base/jdk.internal.reflect.DirectConstructorHandleAccessor.newInstance(DirectConstructorHandleAccessor.java:74)
	at java.base/java.lang.reflect.Constructor.newInstanceWithCaller(Constructor.java:502)
	at java.base/java.lang.reflect.Constructor.newInstance(Constructor.java:486)
	at org.mapstruct.factory.Mappers.doGetMapper(Mappers.java:85)
	... 8 more
Caused by: java.lang.Error: Unresolved compilation problems: 
	The import com.example.demo.models.dtos cannot be resolved
	The import com.example.demo.models.entities cannot be resolved
	AuthorMapper cannot be resolved to a type
	AuthorDTO cannot be resolved to a type
	AuthorEntity cannot be resolved to a type
	AuthorDTO cannot be resolved to a type
	AuthorDTO cannot be resolved to a type
	AuthorEntity cannot be resolved to a type
	AuthorDTO cannot be resolved to a type
	AuthorEntity cannot be resolved to a type
	AuthorEntity cannot be resolved to a type

	at com.example.demo.models.mappers.AuthorMapperImpl.<init>(AuthorMapperImpl.java:3)
	at java.base/jdk.internal.reflect.DirectConstructorHandleAccessor.newInstance(DirectConstructorHandleAccessor.java:62)
	... 11 more

[ERROR] com.example.demo.service.AuthorServiceTests.update_success -- Time elapsed: 0 s <<< ERROR!
java.lang.RuntimeException: java.lang.reflect.InvocationTargetException
	at org.mapstruct.factory.Mappers.doGetMapper(Mappers.java:91)
	at org.mapstruct.factory.Mappers.getMapper(Mappers.java:69)
	at org.mapstruct.factory.Mappers.getMapper(Mappers.java:58)
	at com.example.demo.service.AuthorServiceTests.<init>(AuthorServiceTests.java:31)
	at java.base/java.lang.reflect.Constructor.newInstanceWithCaller(Constructor.java:502)
	at java.base/java.lang.reflect.Constructor.newInstance(Constructor.java:486)
	at java.base/java.util.Optional.orElseGet(Optional.java:364)
	at java.base/java.util.ArrayList.forEach(ArrayList.java:1596)
	at java.base/java.util.ArrayList.forEach(ArrayList.java:1596)
Caused by: java.lang.reflect.InvocationTargetException
	at java.base/jdk.internal.reflect.DirectConstructorHandleAccessor.newInstance(DirectConstructorHandleAccessor.java:74)
	at java.base/java.lang.reflect.Constructor.newInstanceWithCaller(Constructor.java:502)
	at java.base/java.lang.reflect.Constructor.newInstance(Constructor.java:486)
	at org.mapstruct.factory.Mappers.doGetMapper(Mappers.java:85)
	... 8 more
Caused by: java.lang.Error: Unresolved compilation problems: 
	The import com.example.demo.models.dtos cannot be resolved
	The import com.example.demo.models.entities cannot be resolved
	AuthorMapper cannot be resolved to a type
	AuthorDTO cannot be resolved to a type
	AuthorEntity cannot be resolved to a type
	AuthorDTO cannot be resolved to a type
	AuthorDTO cannot be resolved to a type
	AuthorEntity cannot be resolved to a type
	AuthorDTO cannot be resolved to a type
	AuthorEntity cannot be resolved to a type
	AuthorEntity cannot be resolved to a type

	at com.example.demo.models.mappers.AuthorMapperImpl.<init>(AuthorMapperImpl.java:3)
	at java.base/jdk.internal.reflect.DirectConstructorHandleAccessor.newInstance(DirectConstructorHandleAccessor.java:62)
	... 11 more

[ERROR] com.example.demo.service.AuthorServiceTests.create_success -- Time elapsed: 0 s <<< ERROR!
java.lang.RuntimeException: java.lang.reflect.InvocationTargetException
	at org.mapstruct.factory.Mappers.doGetMapper(Mappers.java:91)
	at org.mapstruct.factory.Mappers.getMapper(Mappers.java:69)
	at org.mapstruct.factory.Mappers.getMapper(Mappers.java:58)
	at com.example.demo.service.AuthorServiceTests.<init>(AuthorServiceTests.java:31)
	at java.base/java.lang.reflect.Constructor.newInstanceWithCaller(Constructor.java:502)
	at java.base/java.lang.reflect.Constructor.newInstance(Constructor.java:486)
	at java.base/java.util.Optional.orElseGet(Optional.java:364)
	at java.base/java.util.ArrayList.forEach(ArrayList.java:1596)
	at java.base/java.util.ArrayList.forEach(ArrayList.java:1596)
Caused by: java.lang.reflect.InvocationTargetException
	at java.base/jdk.internal.reflect.DirectConstructorHandleAccessor.newInstance(DirectConstructorHandleAccessor.java:74)
	at java.base/java.lang.reflect.Constructor.newInstanceWithCaller(Constructor.java:502)
	at java.base/java.lang.reflect.Constructor.newInstance(Constructor.java:486)
	at org.mapstruct.factory.Mappers.doGetMapper(Mappers.java:85)
	... 8 more
Caused by: java.lang.Error: Unresolved compilation problems: 
	The import com.example.demo.models.dtos cannot be resolved
	The import com.example.demo.models.entities cannot be resolved
	AuthorMapper cannot be resolved to a type
	AuthorDTO cannot be resolved to a type
	AuthorEntity cannot be resolved to a type
	AuthorDTO cannot be resolved to a type
	AuthorDTO cannot be resolved to a type
	AuthorEntity cannot be resolved to a type
	AuthorDTO cannot be resolved to a type
	AuthorEntity cannot be resolved to a type
	AuthorEntity cannot be resolved to a type

	at com.example.demo.models.mappers.AuthorMapperImpl.<init>(AuthorMapperImpl.java:3)
	at java.base/jdk.internal.reflect.DirectConstructorHandleAccessor.newInstance(DirectConstructorHandleAccessor.java:62)
	... 11 more

[INFO] 
[INFO] Results:
[INFO] 
[ERROR] Errors: 
[ERROR]   DemoApplicationTests.contextLoads  IllegalState Failed to load ApplicationContext for [WebMergedContextConfiguration@4dab3e26 testClass = com.example.demo.DemoApplicationTests, locations = [], classes = [com.example.demo.DemoApplication], contextInitializerClasses = [], activeProfiles = [], propertySourceDescriptors = [], propertySourceProperties = ["org.springframework.boot.test.context.SpringBootTestContextBootstrapper=true"], contextCustomizers = [org.springframework.boot.test.context.filter.ExcludeFilterContextCustomizer@4c98a6d5, org.springframework.boot.test.json.DuplicateJsonObjectContextCustomizerFactory$DuplicateJsonObjectContextCustomizer@4d8126f, org.springframework.boot.test.mock.mockito.MockitoContextCustomizer@0, org.springframework.boot.test.web.client.TestRestTemplateContextCustomizer@2d2690f6, org.springframework.boot.test.web.reactor.netty.DisableReactorResourceFactoryGlobalResourcesContextCustomizerFactory$DisableReactorResourceFactoryGlobalResourcesContextCustomizerCustomizer@1ecfcbc9, org.springframework.boot.test.autoconfigure.OnFailureConditionReportContextCustomizerFactory$OnFailureConditionReportContextCustomizer@55cff952, org.springframework.boot.test.autoconfigure.actuate.observability.ObservabilityContextCustomizerFactory$DisableObservabilityContextCustomizer@1f, org.springframework.boot.test.autoconfigure.properties.PropertyMappingContextCustomizer@0, org.springframework.boot.test.autoconfigure.web.servlet.WebDriverContextCustomizer@9d200de, org.springframework.test.context.support.DynamicPropertiesContextCustomizer@0, org.springframework.boot.test.context.SpringBootTestAnnotation@c608711], resourceBasePath = "src/main/webapp", contextLoader = org.springframework.boot.test.context.SpringBootContextLoader, parent = null]
[ERROR]   AuthorServiceTests.<init>:31  Runtime java.lang.reflect.InvocationTargetException
[ERROR]   AuthorServiceTests.<init>:31  Runtime java.lang.reflect.InvocationTargetException
[ERROR]   AuthorServiceTests.<init>:31  Runtime java.lang.reflect.InvocationTargetException
[ERROR]   AuthorServiceTests.<init>:31  Runtime java.lang.reflect.InvocationTargetException
[ERROR]   AuthorServiceTests.<init>:31  Runtime java.lang.reflect.InvocationTargetException
[INFO] 
[ERROR] Tests run: 13, Failures: 0, Errors: 6, Skipped: 0
[INFO] 
[INFO] ------------------------------------------------------------------------
[INFO] BUILD FAILURE
[INFO] ------------------------------------------------------------------------
[INFO] Total time:  8.284 s
[INFO] Finished at: 2025-01-14T15:15:00-05:00
[INFO] ------------------------------------------------------------------------
[ERROR] Failed to execute goal org.apache.maven.plugins:maven-surefire-plugin:3.5.2:test (default-test) on project demo: 
[ERROR] 
[ERROR] See /home/luciano/Programming/personal/spring-rest-docs-demo/target/surefire-reports for the individual test results.
[ERROR] See dump files (if any exist) [date].dump, [date]-jvmRun[N].dump and [date].dumpstream.
[ERROR] -> [Help 1]
[ERROR] 
[ERROR] To see the full stack trace of the errors, re-run Maven with the -e switch.
[ERROR] Re-run Maven using the -X switch to enable full debug logging.
[ERROR] 
[ERROR] For more information about the errors and possible solutions, please read the following articles:
[ERROR] [Help 1] http://cwiki.apache.org/confluence/display/MAVEN/MojoFailureException
